id,Priority,SR start date/time,Service Category,Service Comments
288,01-Emergency,2022-04-14 11:05:00,Heating and cooling,Last night woke up at 1am to find that the house was over 80 degrees and the air conditioner was not turning on. The air conditioner is set at 70 now and states that the house is 78 degrees and A/C sill not turning on
5404,01-Emergency,2022-10-17 16:32:00,Environmental Concerns,Mold growing under the shower cocking around the shower between the floor and tiles. Also around the cocking in the shower
2992,03-Routine,2022-07-07 08:36:00,Appliance,"Over does not always heat to full temp, sometimes 150-200 degrees below listed temp."
5241,01-Emergency,2022-05-03 19:14:00,Moisture Issues,5/4 Resident submitted through web. Resident states the kitchen ceiling is leaking. Water is dripping.
5086,01-Emergency,2022-05-15 17:06:00,Heating and cooling,Last month the outside unit was making noise as it seems like it was about to fail. I have a recording to show the sound that it was making. Right now the sound is minimum for the upstairs AC is not cooling at all. At this moment it is showing 80 degrees.
3809,03-Routine,2022-03-05 10:06:00,Flooring,"We submitted through housing to have parts of our deck replaced due to rotting planks. It`s been 7 months since we occupied the house and submitted this request and there has been no actual action to replace the deck planks. A contractor came out several months ago to take measurements and nothing else has happened since. The board is now is worse condition and nails are starting to become exposed, creating concerns for injury. Please stop dragging your feet on this and replace the decking."
6348,02-Urgent,2022-09-08 09:50:00,Moisture Issues,Resident stated that there is water coming from window in kitchen by dining room
2782,02-Urgent,2022-07-22 16:00:00,Environmental Concerns,High levels of moisture in dry wall surrounding bathtub/ shower in both upstairs bathrooms
3339,03-Routine,2022-06-21 10:47:00,Grounds and landscaping,"The backyard fence is in terrible shape. Many of the planks are bowed, warped, and dry rotted. Please replace the all the dry, warped, and bowed planks."
4168,03-Routine,2022-03-31 14:16:00,General,Shelf fell needs to be drilled back up
3325,02-Urgent,2022-06-16 18:13:00,Environmental Concerns,We have spotted black mold growth in the upstairs master bathroom.
3385,03-Routine,2022-06-03 21:51:00,Flooring,Top floor of basement stair needs repair
3239,03-Routine,2022-06-02 18:09:00,Appliance,Disposal will not turn on and clogged
1213,01-Emergency,2022-08-29 20:04:00,Safety equipment,First alert keeps chirping
5817,02-Urgent,2022-10-07 08:45:00,Heating and cooling,A/C has been having issues the last couple of days cooling the house after all the rain. It consistently runs and does not cool down to the set temp. It will in fact read the ambient temp going up. My wife has MS and diabetes and can`t be in excessively high temps.
5155,01-Emergency,2022-05-17 14:35:00,Grounds and landscaping,5/17 Resident submitted through the portal. Resident states A hailstorm and a tree fell down out of the backyard and fell into the next tree and may fall as well into the house.
894,03-Routine,2022-08-19 13:53:00,Doors and locks,Need replacement sliding screen Door please. Resident installed screen
2578,02-Urgent,2022-07-12 18:15:00,Heating and cooling,The subunit has not been draining. I have had to use my shop vac twice over the past 2-3 weeks for the AC to cool properly.
4945,01-Emergency,2022-05-15 18:58:00,Heating and cooling,"This is a follow up to previous work request. Interior temp has been above 76 degrees since about the 1st of May. Currently 79 degrees. Have not yet been even contacted about this as of 15 May. With the weather warming up, this is becoming urgent."
1572,01-Emergency,2022-02-07 14:56:00,Doors and locks,Front door lock battery needs replaced.
2554,03-Routine,2022-07-08 21:24:00,Pest Control,Wasps inside the house
150,01-Emergency,2022-04-15 07:52:00,Heating and cooling,"Attempted to turn on A/C yesterday. Nest thermostat has been showing this message ever since: ""Your thermostat cannot control this equipment properly without wiring changes."" We can hear A/C attempting to start up every so often and then will immediately shut back off. Yesterday our indoor temperature got up to 77 degrees with the thermostat set to 67."
273,01-Emergency,2022-04-19 06:53:00,Safety equipment,3rd floor hallway has beeped in the night. We reset so it stooped but please fix
589,02-Urgent,2022-04-18 09:19:00,Heating and cooling,We had an issue with this last year but it cleared up on it`s own. We cleaned up about a gallon of water over the weekend and it`s still leaking. Would like to have it checkout and fixed.
5619,02-Urgent,2022-10-16 18:09:00,Appliance,"Oven pilot out, wont light and appears to be clogged"
5952,03-Routine,2022-09-18 22:43:00,General,Closet rack completely collapsed on master bedroom.
1039,03-Routine,2022-08-01 12:31:00,Heating and cooling,Ac on but no cold air coming out
4936,01-Emergency,2022-05-19 13:39:00,Moisture Issues,Pooling water in utility room
5252,02-Urgent,2022-05-24 14:48:00,Doors and locks,Entry Door isn`t opening
5820,02-Urgent,2022-10-10 16:21:00,Heating and cooling,When fan is on it makes a horrible loud noise like the fan needs lubricant or is hitting something
2393,03-Routine,2022-07-04 11:51:00,Doors and locks,Front door weather stripping is no longer fixed to the bottom. 2 inch gap.
1527,03-Routine,2022-02-20 15:02:00,Safety equipment,"Fire turns on, but blower does not work and it just heats up the mantle"
602,03-Routine,2022-04-06 13:45:00,Pest Control,"Ants, bugs, centipedes all coming in to the main floor"
3699,01-Emergency,2022-06-06 21:17:00,Heating and cooling,A/C lines are freezing over and the A/C is not cooling the house down we have been told in the past that we might be leaving doors open but we haven`t been doing that anymore and we are still having this issue we also was given a new hvac system and it`s still happening
3477,03-Routine,2022-06-01 16:06:00,Appliance,Ice maker does not work. Suspect no water line or water has not been turned on as the water dispenser does not work either.
2148,03-Routine,2022-01-06 21:55:00,Storm Damage,Fallen large branches Low hanging branches Safety issue
4897,01-Emergency,2022-05-04 19:12:00,Plumbing and bath,5/5 Resident submitted through web. Resident states no water still off. No water.
1532,01-Emergency,2022-02-05 00:42:00,Safety equipment,We replaced the batteries in the smoke detector and it is still continuing to chirp every day. The smoke detector needs to be replaced before the chirping can no longer be silenced.
1136,03-Routine,2022-08-29 19:24:00,Heating and cooling,A/c vent near bottom stairwell does not open or close properly. Lever moves but blades do not.
1916,01-Emergency,2022-01-03 21:04:00,Safety equipment,Smoke alarm chirping.
3246,01-Emergency,2022-06-07 14:46:00,Heating and cooling,"The unit inside of the house keeps freezing solid. We turn off the system to thaw and once it is thawed, turn it back on. It will refreeze solid."
946,02-Urgent,2022-08-22 05:20:00,Plumbing and bath,Coin lodged in garbage disposal
5046,02-Urgent,2022-05-18 12:09:00,Environmental Concerns,Mold in tub
2455,01-Emergency,2022-07-25 09:30:00,Heating and cooling,resident stated that their AC is not cooling properly
239,03-Routine,2022-04-07 09:02:00,Electrical and lighting,Light bulb in secondary bedroom (to left of bathroom upstairs) is out
5026,02-Urgent,2022-05-24 14:34:00,Appliance,Doesn`t feel cold
799,01-Emergency,2022-08-15 18:21:00,Safety equipment,Smoke detector in upstairs hallway won`t stop chirping (triple chirp) it`s not the battery.
3290,02-Urgent,2022-06-14 06:45:00,Heating and cooling,Ac unit has had issues in the past. It`s not cooling at all. House is almost 80 degrees. Need a tech to repair asap. Outside condenser fan turning but unit isn`t on.
6250,02-Urgent,2022-09-01 16:20:00,Appliance,Currently cleaning up stinky water off my floor because the dishwasher leaked and it came out of the under the sink cabinet.
4454,01-Emergency,2022-05-17 08:02:00,Plumbing and bath,5/17 Resident submitted through the portal. Resident states no hot water since yesterday.
2039,03-Routine,2022-01-28 19:16:00,Plumbing and bath,The hot water heater doesn`t stay hot to long.
4605,03-Routine,2022-05-18 20:03:00,Plumbing and bath,Master bathroom sink
4806,02-Urgent,2022-05-18 17:30:00,Plumbing and bath,5/19 Resident submitted through the portal. Resident states sink is leaking underneath and flowing directly to the hallway.
6236,02-Urgent,2022-09-22 16:31:00,Heating and cooling,"The thermostat shows there is an issue with sensors, and the a/c is absurdly loud."
129,02-Urgent,2022-04-13 08:58:00,Heating and cooling,A/C not cooling the house in the house actually got 5 degrees warmer with the A/C on. Also need replacement air filters I removed the last set because it was dirty and need replacement
565,03-Routine,2022-04-06 13:48:00,General,Master closet rod is not supported by a stud and is falling out from the wall
2390,02-Urgent,2022-07-21 07:17:00,Plumbing and bath,"Toilet in master bedroom has not been flushing well since move-in. Used plunger many times, but no luck. Toilet is completely clogged now. Resident also stated that now there is sewer water coming out of the toilets along with the maintenance closet"
588,01-Emergency,2022-04-17 04:54:00,Safety equipment,The smoke detectors are randomly going off for a couple seconds in the middle of the night. We are assuming that is there way of telling us the batteries need replaced.
5089,02-Urgent,2022-05-03 07:52:00,Appliance,5/3 Resident submitted through web. Resident states the DW is leaking water is leaking water when it`s running.
4915,02-Urgent,2022-05-26 20:36:00,Plumbing and bath,Pipe leaking under kitchen sink.
4550,01-Emergency,2022-05-09 08:35:00,Doors and locks,5/9 Resident submitted through web. Front door is not working. It flashes red and green. They jump at the back o get into the back door and able to get in but very hard to do it every time.
2943,02-Urgent,2022-07-05 18:45:00,Appliance,"Maintenance came out today and said ""dishwasher is not leaking"". Told us to use different dish soap. We ran the dishwasher tonight with no soap in it and it is still leaking water on the floor. I have pictures to prove it."
1208,02-Urgent,2022-08-19 07:26:00,Doors and locks,Requesting digital lock due to no key being provided and available for lock.
4536,01-Emergency,2022-05-05 10:01:00,Building exterior,"5/5 Resident submitted through web. Resident states the steps leading to their front door, one of the wood strips are rotted and busted through. Does not want anyone to get hurt, outside their unit. They have movers coming through the stairs."
5158,02-Urgent,2022-05-21 13:11:00,Appliance,5/23 Resident submitted through the portal. Resident states fridge is not working and make their food turns to bed. It will not chill or it`s not cooling anymore.
301,01-Emergency,2022-04-01 15:15:00,Doors and locks,Lock broke and came out of door. 4/4 Residnet called and enter any time without resident home.
2202,03-Routine,2022-01-21 19:13:00,Flooring,A small crack between the living room and front hall has grown since we moved in last year and air is coming through it.
1658,03-Routine,2022-02-28 14:40:00,Electrical and lighting,Light bulb in oven is out please replace.
372,03-Routine,2022-04-15 15:30:00,General,Deck is beginning to rot and needs stained.
734,03-Routine,2022-08-30 13:25:00,Appliance,Ice maker is broken
6147,01-Emergency,2022-09-13 08:54:00,Moisture Issues,Things are molding in basement. Can we get a dehumidifier?
2454,01-Emergency,2022-07-25 08:10:00,Appliance,The refrigerator is not cooling.
5815,02-Urgent,2022-10-21 00:21:00,Plumbing and bath,kitchen drainage is leaking after they work on it
2402,01-Emergency,2022-07-09 08:45:00,Heating and cooling,7/11 resident submitted though the web.
2458,01-Emergency,2022-07-31 13:58:00,General,We found mold and water in the area above the stove this is the 3rd or 4th time for the same problem. Also looks like mold in the ceiling in family room and kitchen. Water spots appeared after heavy rain.
11,01-Emergency,2022-04-08 12:24:00,Safety equipment,Smoke detector beeps even with new batteries.
3744,02-Urgent,2022-06-21 05:33:00,Appliance,Refrigerator not cold enough and freezer not freezing after adjusting temperature
5230,02-Urgent,2022-05-03 17:38:00,Plumbing and bath,Leak from under the sink is back again.
4428,01-Emergency,2022-05-19 13:00:00,Heating and cooling,5/19 Resident submitted through the portal. Resident states the AC in the second floor of the unit is not blowing cold air. Resident tried to close other vent to push air up the second floor but still not working.
6267,02-Urgent,2022-09-06 03:46:00,Heating and cooling,The AC is not cooling to the temp it is set at
6064,02-Urgent,2022-09-29 03:30:00,Appliance,10/6 Resident states fridge is still leaking.
4738,02-Urgent,2022-05-25 07:53:00,Heating and cooling,AC unit is freezing over after last recharge. No ETA on replacement unit.
270,03-Routine,2022-04-18 17:14:00,Common Areas,Could not find entry for block water drain. The water drain on the inter loop street of Jadwin loop near 5449 is blocked by wooden debris and creates a water pool after a rainy day. No access required of my unit.
1720,02-Urgent,2022-02-03 17:38:00,Heating and cooling,"The issue has been continuous since the Nest Thermostat was installed. When the heat comes on it turns on for a minute or two then turns itself off and an error message is sent to the Nest App. The error message says, E160: No Power to Y1 wire. The house still receives heat after random intervals throughout the day but that error message is sent continuously throughout the day, particularly in the morning."
449,01-Emergency,2022-04-22 18:36:00,Heating and cooling,"NEST thermostat is not working. Air conditioning won`t turn on, heat won`t turn on. the system at times with start without any temperature change and then shut off after a few seconds."
425,01-Emergency,2022-04-02 16:32:00,Plumbing and bath,"DW is still leaking after attempted repair was made on 2 APR 22. Water is behind dishwasher, under fridge, under sink cabinets, and leaking through pantry floor. Request immediate replacement of dishwasher with one that works. Saying it was a loose gasket, wiggling it, and then telling the leasee that sometimes you have to manually adjust it is not the proper way to fix things. There needs to be proper water remediation to prevent mold."
2001,02-Urgent,2022-01-05 18:32:00,Plumbing and bath,Slow link under kitchen sink. Water and moisture underneath.
3162,01-Emergency,2022-06-09 13:07:00,Safety equipment,resident stated that smoke detector are beeping
2389,02-Urgent,2022-07-25 18:35:00,Plumbing and bath,The previous work order was cancelled without solution. Master shower does not get hot. Requesting faucet adjustment so water can be adjusted hotter. Thank you!
4278,02-Urgent,2022-03-28 11:42:00,Heating and cooling,The heater does not get to desired temperature. It keeps turning on and off with a light flashing on the thermostat.
1662,03-Routine,2022-02-09 16:45:00,Doors and locks,Garage door will not always close and open while using either garage door opener OR the opener on the wall.
2486,01-Emergency,2022-07-27 10:03:00,Environmental Concerns,There is Black Mold on my ceiling in master bathroom
2225,01-Emergency,2022-01-25 09:38:00,Plumbing and bath,"My upstairs bathroom. Is flooding my bathroom and is leaking threw the ceiling into my kitchen stove. I can not use my toilet, sink or bathtub. When any water drains in my bathroom, it is coming threw the side of the toilet and then start to leak threw onto my stove."
1515,02-Urgent,2022-02-28 22:49:00,Appliance,I couldn`t find the right label but the fridge sprays water on the back and the ice maker doesn`t work.
4493,02-Urgent,2022-05-10 22:20:00,Plumbing and bath,Ceiling is wet & dripping downstairs
1225,01-Emergency,2022-08-31 21:10:00,Safety equipment,9/6 Called and the phone just kept ringing LT
106,03-Routine,2022-04-28 14:35:00,Common Areas,2 broken pieces
5045,03-Routine,2022-05-31 08:09:00,General,"Back patio, handrail is loos at the base. PTE"
5143,02-Urgent,2022-05-03 20:11:00,Heating and cooling,Warm air is coming out the vents with the ac turned on. The outside unit doesn`t appear to be working.
5906,02-Urgent,2022-10-30 10:20:00,Heating and cooling,We had our entire unit replaced in September due to mold displacement. New unit heat does not work. Unit will kick on but does not warm
2141,03-Routine,2022-01-24 15:28:00,Heating and cooling,Vent cover doesn`t stay on the ceiling
50,02-Urgent,2022-04-15 09:14:00,Heating and cooling,Humidity level is constantly above 55% all windows are closed. NEST is accurate it is humid in the house. Air conditioner unit is also very loud to the point where our neighbors have complained about the noise.
5212,01-Emergency,2022-05-21 17:57:00,Moisture Issues,5/23 Resident submitted through the portal. Resident states water leaking from his roof/ceiling on the first floor.
3262,02-Urgent,2022-06-01 14:57:00,Plumbing and bath,Pilot light out
3245,02-Urgent,2022-06-08 12:35:00,Plumbing and bath,"Faucet in Kitchen sink is broken, water doesnt run"
3442,03-Routine,2022-06-16 17:10:00,Building exterior,"I purchased two flag brackets (the one on the home is not usable) and I would like help installing them. There is significant damage on the columns holding up the porch roof, and you can see where brackets were installed in the past. I would like the brackets installed on the outer most columns adjacent to the front door (same place where the brackets appear to have been). Please call for clarification."
3651,02-Urgent,2022-06-17 23:47:00,Doors and locks,Key to the exterior garage door does not read. Battery needs replacement? Also the door will not latch to the striker plate. May need to replace door knob and latch mechanism.
6303,02-Urgent,2022-09-08 07:08:00,Plumbing and bath,Toilet in master bathroom is clogged. Used plunger multiple times--no luck. Tub is also not draining (still) and may be contributing to the issue.
2788,01-Emergency,2022-07-26 11:31:00,Doors and locks,Garage door broken
101,02-Urgent,2022-04-15 08:28:00,Plumbing and bath,Water leaking from underneath kitchen cabinet. Not in the cabinet itself. Water floods out from underneath dishwasher into kitchen.
5320,03-Routine,2022-10-06 18:56:00,Doors and locks,6 blinds are missing and need replaced on back door. Back screendoor is off the tracks.
5348,02-Urgent,2022-10-25 19:13:00,Plumbing and bath,Water is leaking from the pipes underneath the sink. Found sprayer leaking on sink
1993,03-Routine,2022-01-17 11:38:00,Doors and locks,Weather strip is coming off and cold air is coming in house making it cold on first floor.
5967,01-Emergency,2022-09-19 14:50:00,Heating and cooling,The a/c runs continuously and does not get to the temp I would like. I have the temp set to 70 during the day and 68 at night. This has been my setting for over a year without issue. They came out last week to work on it but it didn`t help. Also there was a loud grinding noise that came from the ac unit. Checked a/c unit working fine
2643,02-Urgent,2022-07-20 13:19:00,Heating and cooling,Need new air filter in dining room and unit outside is making a weird noise that sounds like a drill every time it kicks on
1791,03-Routine,2022-02-06 19:39:00,Plumbing and bath,We haven`t had any hot water since 3pm 20210206
5822,01-Emergency,2022-10-09 16:48:00,Environmental Concerns,"suspected hvac mold and suspeted mold in the master. water damaged in HVAC, kitchen, bathroom."
5765,01-Emergency,2022-10-18 11:18:00,Safety equipment,Keeps beeping and saying low battery
3958,03-Routine,2022-03-04 10:16:00,Pest Control,3 mouse in last week
5354,03-Routine,2022-10-17 20:59:00,Electrical and lighting,The refeigerator breaker has begun to trip daily.
5153,02-Urgent,2022-05-08 20:07:00,Appliance,"OVEN is broken, will not heat up, just says PRE but no heat. Broiled does work though."
2191,01-Emergency,2022-01-22 10:12:00,Safety equipment,Replaced batteries but still beeping. They alll need to be reinspected.
1543,03-Routine,2022-02-14 20:21:00,Electrical and lighting,Living room ceiling fan does not work
964,02-Urgent,2022-08-03 11:39:00,Appliance,The disposal is leaking under the sink and was not originally notice so there is black water marks under the sink.
3326,01-Emergency,2022-06-11 10:58:00,Doors and locks,The lock on our front door flashes red when we put the key in. We have to try multiple times before it flashes green and allows us to lock or unlock our door.
5115,03-Routine,2022-05-22 08:53:00,Flooring,"I have submitted multiple tickets, my last one being in January, and there has been no action taken on this. Water is in the flooring which means there is likely mold underneath causing unsafe conditions for my family. Bugs are now coming through the floorboards. The flooring will be replaced immediately or this issue will be taken to Post Command and to court. You are not holding up your end of the lease agreement by providing livable conditions. The lease needs to be broken."
2836,03-Routine,2022-07-11 04:18:00,Plumbing and bath,Faucet is leaking
4445,02-Urgent,2022-05-19 12:58:00,Doors and locks,5/19 Resident submitted through the portal. Resident states the garage bracket bold has broken off and door is not locking or securing anymore.
4406,02-Urgent,2022-05-04 07:47:00,Heating and cooling,5/5 Resident submitted through web. Resident states ac is not truing on. No ac with medical issue.
5645,02-Urgent,2022-10-11 12:27:00,Plumbing and bath,Toilet overflowed in hall bathroom on second floor.
4804,01-Emergency,2022-05-22 18:40:00,Electrical and lighting,5/23 Resident submitted through the portal. Resident states no power.
4840,01-Emergency,2022-05-12 17:47:00,Doors and locks,5/13 Resident submitted through the portal. Resident states neighbors vacated the house but it`s wide open. Requested to secure or lock it. Don`t anyone to enter the unit.
4965,01-Emergency,2022-05-22 20:47:00,Electrical and lighting,5/23 Resident states there is no power in the entire unit for about 4hours already.
2807,03-Routine,2022-07-05 18:18:00,Electrical and lighting,"The storage Unit outlets do not work, there is no electricity in unit Reset GFCI Outlets test all outside outlets and shed has power"
5182,02-Urgent,2022-05-31 07:44:00,Heating and cooling,resident states downstairs AC above 79 typically
2682,01-Emergency,2022-07-25 16:33:00,LHS Inspections,Suspected mold in master bath we final out on the 26th
4330,01-Emergency,2022-05-23 09:44:00,Heating and cooling,Major AC unit Water leak over the weekend damaged the master bedroom ceiling. Sitting Water needs also to be pumped out underneath the AC unit. Mold concerns at this point. Please attend asap.
4609,02-Urgent,2022-05-04 11:58:00,Appliance,"Dishwasher continues to have a pool of dirty water at the bottom. Maintenance has come out to drain it and I was told it was normal to have a pool of water. Dishes are not being cleaned even on ""heavy wash"" setting."
696,03-Routine,2022-08-14 12:36:00,General,Towel bar is broken
4068,01-Emergency,2022-03-28 15:49:00,Safety equipment,Smoke detector beeping
5576,02-Urgent,2022-10-09 10:50:00,Heating and cooling,The heater does not turn on & heat even when turned on thru app and the nest
2571,02-Urgent,2022-07-24 12:01:00,Plumbing and bath,Sink does not drain at all
5471,02-Urgent,2022-10-02 20:27:00,Plumbing and bath,"Toilet in Master bathroom leaking water underneath. Please schedule the service as soon as possible, in afternoon time. Thanks."
6388,03-Routine,2022-09-17 17:36:00,Appliance,Leaks
1414,03-Routine,2022-08-31 08:01:00,General,"There is another fence board loose now and hanging (possibly popped off when they were working on the last board). Additionally, the first one only received a temporary fix, the long board on the bottom is what needs replacing, but it sounded like you all didn`t have the length of board available. This new board is a top long board that is holding the other vertical ones in."
3278,02-Urgent,2022-06-13 14:09:00,Plumbing and bath,"Water heater seems to be constantly draining water. Water isn`t leaking from the drip pan, but again, seems to be constantly draining water. Just want to make sure it`s working properly."
5495,01-Emergency,2022-10-03 14:43:00,Environmental Concerns,Suspect Black Mold in bathroom on wall
5635,02-Urgent,2022-10-04 07:41:00,Heating and cooling,Heater is not working
2459,03-Routine,2022-07-05 20:19:00,Safety equipment,Garage door won't open. Ajusted chain on garage door
1438,03-Routine,2022-08-24 09:51:00,Grounds and landscaping,"The main house water drains are clogged up, causing water to stay trapped encouraging mosquito breeding. The water ducts in the main house need to be cleared. My daughter is allergic to the mosquito bites, however mosquitoes also pose a critical health hazard to the public, please resolve as urgently as possible."
3594,01-Emergency,2022-06-26 23:20:00,Safety equipment,Master bedroom smoke alarm won`t stop tripping the alarm. The smoke detector beeped then triggered the fire alarm. Pressing the button did not fix the issue. Removed the detector and removed the batteries.
1218,01-Emergency,2022-08-02 07:56:00,Safety equipment,Smoke detector keeps chirping need batteries replaced
4059,02-Urgent,2022-03-27 11:42:00,Heating and cooling,The heater is not staying on. We turned off the heater and also flipped the circuit on/off. The heater will turn on for a few minutes then turn back off.
5025,01-Emergency,2022-05-12 17:28:00,Doors and locks,5/13 Resident submitted through the portal. Resident states the key snapped in half and stuck in the lock out of the home. Waiting outside home.
